{
  "alternatives": [
    {
      "constraints": [
        0
      ],
      "decision": {
        "kind": "candidate"
      },
      "identifier": "candidate",
      "objectives": [
        0,
        0
      ]
    },
    {
      "constraints": [
        -2
      ],
      "decision": {
        "kind": "core"
      },
      "identifier": "core0",
      "objectives": [
        4,
        3
      ]
    },
    {
      "constraints": [
        -2
      ],
      "decision": {
        "kind": "core"
      },
      "identifier": "core1",
      "objectives": [
        2,
        7
      ]
    },
    {
      "constraints": [
        1
      ],
      "decision": {
        "kind": "noise"
      },
      "identifier": "noise0",
      "objectives": [
        5,
        3
      ]
    },
    {
      "constraints": [
        1
      ],
      "decision": {
        "kind": "noise"
      },
      "identifier": "noise1",
      "objectives": [
        1,
        7
      ]
    },
    {
      "constraints": [
        4
      ],
      "decision": {
        "kind": "noise"
      },
      "identifier": "noise2",
      "objectives": [
        4,
        5
      ]
    },
    {
      "constraints": [
        -1
      ],
      "decision": {
        "kind": "noise"
      },
      "identifier": "noise3",
      "objectives": [
        7,
        6
      ]
    }
  ],
  "candidate_id": "candidate",
  "constraint_scales": [
    4
  ],
  "digest": "sha256:36c14a2b5274ee7e4482ee73f8af2ca9d5ee69f869e4c98cbf09f124cb33d99e",
  "family": "explicit_controlled",
  "identifier": "explicit-p2-harmless-s104",
  "metadata": {
    "seed": 104,
    "target_class": "harmless"
  },
  "objective_scales": [
    7,
    7
  ],
  "schema": "mmor-verification-instance-1.0"
}
