{
  "alternatives": [
    {
      "constraints": [
        0
      ],
      "decision": {
        "kind": "candidate"
      },
      "identifier": "candidate",
      "objectives": [
        0,
        0,
        0,
        0
      ]
    },
    {
      "constraints": [
        3
      ],
      "decision": {
        "kind": "core"
      },
      "identifier": "core0",
      "objectives": [
        7,
        4,
        1,
        2
      ]
    },
    {
      "constraints": [
        3
      ],
      "decision": {
        "kind": "core"
      },
      "identifier": "core1",
      "objectives": [
        2,
        7,
        1,
        4
      ]
    },
    {
      "constraints": [
        0
      ],
      "decision": {
        "kind": "core"
      },
      "identifier": "core2",
      "objectives": [
        3,
        4,
        5,
        2
      ]
    },
    {
      "constraints": [
        0
      ],
      "decision": {
        "kind": "core"
      },
      "identifier": "core3",
      "objectives": [
        1,
        2,
        3,
        7
      ]
    },
    {
      "constraints": [
        3
      ],
      "decision": {
        "kind": "noise"
      },
      "identifier": "noise0",
      "objectives": [
        5,
        2,
        7,
        5
      ]
    },
    {
      "constraints": [
        -1
      ],
      "decision": {
        "kind": "noise"
      },
      "identifier": "noise1",
      "objectives": [
        5,
        3,
        7,
        1
      ]
    },
    {
      "constraints": [
        4
      ],
      "decision": {
        "kind": "noise"
      },
      "identifier": "noise2",
      "objectives": [
        6,
        1,
        5,
        7
      ]
    },
    {
      "constraints": [
        -2
      ],
      "decision": {
        "kind": "noise"
      },
      "identifier": "noise3",
      "objectives": [
        4,
        3,
        5,
        7
      ]
    }
  ],
  "candidate_id": "candidate",
  "constraint_scales": [
    4
  ],
  "digest": "sha256:4e73a78d508303ee4d77f4d382967cb457e396868c5f34193d83bd516006c05c",
  "family": "explicit_controlled",
  "identifier": "explicit-p4-harmless-s103",
  "metadata": {
    "seed": 103,
    "target_class": "harmless"
  },
  "objective_scales": [
    7,
    7,
    7,
    7
  ],
  "schema": "mmor-verification-instance-1.0"
}
