{
  "alternatives": [
    {
      "constraints": [
        0
      ],
      "decision": {
        "kind": "candidate"
      },
      "identifier": "candidate",
      "objectives": [
        0,
        0,
        0,
        0
      ]
    },
    {
      "constraints": [
        1
      ],
      "decision": {
        "kind": "core"
      },
      "identifier": "core0",
      "objectives": [
        -1,
        0,
        0,
        0
      ]
    },
    {
      "constraints": [
        1
      ],
      "decision": {
        "kind": "core"
      },
      "identifier": "core1",
      "objectives": [
        0,
        -1,
        0,
        0
      ]
    },
    {
      "constraints": [
        1
      ],
      "decision": {
        "kind": "core"
      },
      "identifier": "core2",
      "objectives": [
        0,
        0,
        -1,
        0
      ]
    },
    {
      "constraints": [
        1
      ],
      "decision": {
        "kind": "core"
      },
      "identifier": "core3",
      "objectives": [
        0,
        0,
        0,
        -1
      ]
    },
    {
      "constraints": [
        2
      ],
      "decision": {
        "kind": "noise"
      },
      "identifier": "noise0",
      "objectives": [
        6,
        2,
        5,
        5
      ]
    },
    {
      "constraints": [
        0
      ],
      "decision": {
        "kind": "noise"
      },
      "identifier": "noise1",
      "objectives": [
        5,
        2,
        6,
        3
      ]
    },
    {
      "constraints": [
        4
      ],
      "decision": {
        "kind": "noise"
      },
      "identifier": "noise2",
      "objectives": [
        7,
        6,
        2,
        1
      ]
    },
    {
      "constraints": [
        4
      ],
      "decision": {
        "kind": "noise"
      },
      "identifier": "noise3",
      "objectives": [
        4,
        1,
        1,
        4
      ]
    }
  ],
  "candidate_id": "candidate",
  "constraint_scales": [
    4
  ],
  "digest": "sha256:57a9c4d58cf64191c3eefd5870c9404f856a0df5755677fe4a67881d5d9c949a",
  "family": "explicit_controlled",
  "identifier": "explicit-p4-repairable-s105",
  "metadata": {
    "seed": 105,
    "target_class": "repairable"
  },
  "objective_scales": [
    7,
    6,
    6,
    5
  ],
  "schema": "mmor-verification-instance-1.0"
}
