{
  "alternatives": [
    {
      "constraints": [
        0
      ],
      "decision": {
        "kind": "candidate"
      },
      "identifier": "candidate",
      "objectives": [
        0,
        0,
        0
      ]
    },
    {
      "constraints": [
        1
      ],
      "decision": {
        "kind": "core"
      },
      "identifier": "core0",
      "objectives": [
        1,
        -1,
        -1
      ]
    },
    {
      "constraints": [
        1
      ],
      "decision": {
        "kind": "core"
      },
      "identifier": "core1",
      "objectives": [
        -1,
        1,
        -1
      ]
    },
    {
      "constraints": [
        -2
      ],
      "decision": {
        "kind": "core"
      },
      "identifier": "core2",
      "objectives": [
        -1,
        -1,
        1
      ]
    },
    {
      "constraints": [
        1
      ],
      "decision": {
        "kind": "noise"
      },
      "identifier": "noise0",
      "objectives": [
        4,
        6,
        5
      ]
    },
    {
      "constraints": [
        -2
      ],
      "decision": {
        "kind": "noise"
      },
      "identifier": "noise1",
      "objectives": [
        7,
        3,
        1
      ]
    },
    {
      "constraints": [
        -1
      ],
      "decision": {
        "kind": "noise"
      },
      "identifier": "noise2",
      "objectives": [
        2,
        5,
        2
      ]
    },
    {
      "constraints": [
        4
      ],
      "decision": {
        "kind": "noise"
      },
      "identifier": "noise3",
      "objectives": [
        6,
        2,
        6
      ]
    }
  ],
  "candidate_id": "candidate",
  "constraint_scales": [
    4
  ],
  "digest": "sha256:4990efdf1d3c0e7e8d4330cdc355d5cc832529cf7d872a352af481ece7a035f2",
  "family": "explicit_controlled",
  "identifier": "explicit-p3-irreparable-s104",
  "metadata": {
    "seed": 104,
    "target_class": "irreparable"
  },
  "objective_scales": [
    7,
    6,
    6
  ],
  "schema": "mmor-verification-instance-1.0"
}
