{
  "alternatives": [
    {
      "constraints": [
        0
      ],
      "decision": {
        "kind": "candidate"
      },
      "identifier": "candidate",
      "objectives": [
        0,
        0
      ]
    },
    {
      "constraints": [
        1
      ],
      "decision": {
        "kind": "core"
      },
      "identifier": "core0",
      "objectives": [
        1,
        -2
      ]
    },
    {
      "constraints": [
        -1
      ],
      "decision": {
        "kind": "core"
      },
      "identifier": "core1",
      "objectives": [
        -2,
        1
      ]
    },
    {
      "constraints": [
        -1
      ],
      "decision": {
        "kind": "noise"
      },
      "identifier": "noise0",
      "objectives": [
        6,
        4
      ]
    },
    {
      "constraints": [
        1
      ],
      "decision": {
        "kind": "noise"
      },
      "identifier": "noise1",
      "objectives": [
        7,
        5
      ]
    },
    {
      "constraints": [
        2
      ],
      "decision": {
        "kind": "noise"
      },
      "identifier": "noise2",
      "objectives": [
        6,
        4
      ]
    },
    {
      "constraints": [
        1
      ],
      "decision": {
        "kind": "noise"
      },
      "identifier": "noise3",
      "objectives": [
        7,
        6
      ]
    }
  ],
  "candidate_id": "candidate",
  "constraint_scales": [
    2
  ],
  "digest": "sha256:a22d064f331e1dcd6790f52022b560399c562cfc40e6e73ab35ba265445de958",
  "family": "explicit_controlled",
  "identifier": "explicit-p2-irreparable-s103",
  "metadata": {
    "seed": 103,
    "target_class": "irreparable"
  },
  "objective_scales": [
    7,
    6
  ],
  "schema": "mmor-verification-instance-1.0"
}
