{
  "alternatives": [
    {
      "constraints": [
        0
      ],
      "decision": {
        "kind": "candidate"
      },
      "identifier": "candidate",
      "objectives": [
        0,
        0
      ]
    },
    {
      "constraints": [
        1
      ],
      "decision": {
        "kind": "core"
      },
      "identifier": "core0",
      "objectives": [
        -1,
        0
      ]
    },
    {
      "constraints": [
        1
      ],
      "decision": {
        "kind": "core"
      },
      "identifier": "core1",
      "objectives": [
        0,
        -1
      ]
    },
    {
      "constraints": [
        4
      ],
      "decision": {
        "kind": "noise"
      },
      "identifier": "noise0",
      "objectives": [
        5,
        5
      ]
    },
    {
      "constraints": [
        -1
      ],
      "decision": {
        "kind": "noise"
      },
      "identifier": "noise1",
      "objectives": [
        1,
        1
      ]
    },
    {
      "constraints": [
        0
      ],
      "decision": {
        "kind": "noise"
      },
      "identifier": "noise2",
      "objectives": [
        1,
        4
      ]
    },
    {
      "constraints": [
        -1
      ],
      "decision": {
        "kind": "noise"
      },
      "identifier": "noise3",
      "objectives": [
        3,
        2
      ]
    }
  ],
  "candidate_id": "candidate",
  "constraint_scales": [
    4
  ],
  "digest": "sha256:57338b7619dc1c168209b7ec5df64ca49d922b0ff526299e3d903f3d49b35ac6",
  "family": "explicit_controlled",
  "identifier": "explicit-p2-repairable-s105",
  "metadata": {
    "seed": 105,
    "target_class": "repairable"
  },
  "objective_scales": [
    5,
    5
  ],
  "schema": "mmor-verification-instance-1.0"
}
